{
  "schema_version": "xverse.macho-campaign/v1",
  "campaign_id": "replace-me-macho-campaign",
  "target": {
    "path": "/replace/target",
    "sha256": "0000000000000000000000000000000000000000000000000000000000000000",
    "macho_uuid": "00000000-0000-0000-0000-000000000000",
    "code_signature_sha256": "0000000000000000000000000000000000000000000000000000000000000000",
    "cdhash": "0000000000000000000000000000000000000000",
    "signing_identifier": "replace.me",
    "team_identifier": "replace-me",
    "architecture": "arm64e",
    "product_name": "macOS",
    "product_version": "replace-me",
    "product_build": "25A000"
  },
  "control": {
    "path": "/replace/control",
    "sha256": "0000000000000000000000000000000000000000000000000000000000000000",
    "macho_uuid": "00000000-0000-0000-0000-000000000000",
    "code_signature_sha256": "0000000000000000000000000000000000000000000000000000000000000000",
    "cdhash": "0000000000000000000000000000000000000000",
    "signing_identifier": "replace.me",
    "team_identifier": "replace-me",
    "architecture": "arm64e",
    "product_name": "macOS",
    "product_version": "replace-me",
    "product_build": "24A000"
  },
  "coordinator": "replace-me-coordinator",
  "worker": "replace-me-worker",
  "hardware_model": "Mac0,0",
  "worker_acceptance_path": "worker-acceptance.json",
  "worker_acceptance_sha256": "0000000000000000000000000000000000000000000000000000000000000000",
  "input_model": "replace with bounded input model",
  "authorization": {
    "campaign_id": "replace-me-macho-campaign",
    "target_sha256": "0000000000000000000000000000000000000000000000000000000000000000",
    "target_uuid": "00000000-0000-0000-0000-000000000000",
    "control_sha256": "0000000000000000000000000000000000000000000000000000000000000000",
    "control_uuid": "00000000-0000-0000-0000-000000000000",
    "target_identity_sha256": "0000000000000000000000000000000000000000000000000000000000000000",
    "control_identity_sha256": "0000000000000000000000000000000000000000000000000000000000000000",
    "coordinator": "replace-me-coordinator",
    "worker": "replace-me-worker",
    "hardware_model": "Mac0,0",
    "input_model": "replace with bounded input model",
    "kind": "published-bounty",
    "scope_url": "https://security.apple.com/bounty/categories/",
    "scope_evidence": {
      "path": "scope.html",
      "sha256": "0000000000000000000000000000000000000000000000000000000000000000",
      "size": 0
    },
    "scope_checked_at": "1970-01-01T00:00:00Z",
    "expires_at": "1970-01-01T00:00:00Z",
    "statement": "NOT AUTHORIZED: replace every placeholder after review",
    "authorized_by": "replace-me-authority",
    "authority_key_sha256": "0000000000000000000000000000000000000000000000000000000000000000",
    "signature_ssh": ""
  }
}
